fragment_id,response_no,response
DP03_2,5,DNA testing should be used in criminal cases because it helps form accurate judgements.
DP03_2,6,DNA testing in a criminal case is necessary for an accurate judgment.
DP03_2,7,"We should permit DNA testing in criminal cases, because they provide accurate judgement."
DP03_2,8,We should have DNA testing in criminal cases because it provides accurate judgement.
DP03_2,9,"DNA testing has been proved in criminal cases to be a means for accurate judgement, as such DNA testing is important to fair trials."
DP03_2,10,DNA testing in criminal cases is helpful because it produces accurate judgement
DP03_3,1,"DNA is a reliable identifier and leads to accurate judgment.  Therefore, DNA testing should be used in criminal cases."
DP03_3,2,DNA testing in criminal cases is necessary for accurate judgement.
DP03_3,3,DNA testing in criminal cases is required as a measure for accurate judgement which is prudent as DNA is a reliable identifier.
DP03_3,4,DNA testing is useful in criminal cases since it aids in accurate judgment owing to the fact that it is a reliable identifier
DP03_3,5,"In criminal cases, accurate judgements are imperative. Fortunately, DNA is a reliable identifier that ensures such accurate judgements. Therefore DNA testing in criminal cases is necessary."
DP03_3,6,"DNA is generally used to solve crimes in one of two ways. In cases where a suspect is identified, a sample of that person's DNA can be compared to evidence from the crime scene. The results of this comparison may help establish whether the suspect committed the crime."
DP03_3,7,We should use DNA testing in criminal cases because it has been shown to be a reliable identifier of identities.
DP03_3,8,"In the annals of court, only the strictest judgment should be appraised . This takes the form of DNA"
DP03_3,9,DNA testing in criminal cases is necessary because DNA is an accurate and reliable identifier.
DP03_3,10,DNA testing in criminal cases means a more accurate judgment so we should use it in criminal cases.
DP03_3,11,DNA testing produces accurate judgement in criminal cases.
DP03_3,12,DNA testing in criminal cases is necessary for accurate judgment because DNA is a reliable identifier
DP03_3,13,"We need DNA testing in criminal cases, because it is a reliable identifier."
DP03_3,14,"We need to use DNA testing in criminal cases for accurate judgement, because DNA is a reliable identifier."
DP03_3,15,DNA testing should be used in criminal cases because it helps improve accuracy of judgement.
DP03_3,16,"DNA testing allows for accurate judgment in criminal cases because DNA is a reliable identifier, therefore DNA testing is a needed aspect in criminal cases."
DP03_3,17,We should use DNA testing in criminal cases because it is a reliable identifier s
DP03_3,18,"DNA is a reliable identifier, which makes DNA testing an extremely accurate and much-needed means of judgment for criminal cases."
DP03_4,1,DNA evidence is not always needed as sometimes there is other evidence available for accurate judgment.
DP03_4,2,"Because DNA evidence is not always available for every case, it is not essential to criminal cases."
DP03_4,3,Not all criminal cases can be confirmed using DNA testing.
DP03_4,4,Some may claim DNA testing in criminal cases is a means for accurate judgement which unprovoked as DNA evidence is usually not available in many cases.
DP03_4,5,"Since DNA evidence is not always available, it is not the only way to produce an accurate judgement."
DP03_4,6,"Pundits argue that DNA testing in criminal cases makes for accurate judgements, even though DNA evidence is not available in many cases.  Clearly, then DNA testing in criminal cases should not be deemed as always required."
DP03_4,7,DNA testing is not always needed to prove your case in a court preceeding.
DP03_4,8,"Though DNA testing is often an accurate judgement measure, DNA evidence can't be required as a proof because it's not always available."
DP03_4,9,We should not always DNA test in criminal cases because it is not always available.
DP03_4,10,DNA testing in criminal cases in not always necessary because it is not always available in all cases.
DP03_4,11,DNA evidence is not always available in criminal cases so DNA testing shouldn't always be used.
DP03_4,12,"With the lack of availability to DNA evidence in many cases, DNA evidence should not be necessary for accurate judgment."
DP03_4,13,"DNA testing isn't always needed, because in many cases it is not always available."
DP03_4,14,DNA testing in criminal cases is not always needed since it is not available in many cases.
DP03_4,15,We shouldn't always use DNA testing in criminal cases because it is not available in many cases.
DP03_4,16,"While DNA testing in criminal cases had led to sounder, better, and most importantly more accurate judgements it is not always availible in many criminal cases. Following this line of logic DNA testing is not always needed."
DP03_4,17,DNA evidence is not always available in criminal cases
DP03_4,18,Having DNA testing in criminal cases does not give true evidence  because it is not availaible in many cases.
DP03_4,19,We should not require DNA testing in criminal cases because DNA evidence is not available in many cases.
DP04_1,1,We need the death penalty to deter crime.
DP04_1,2,The death penalty is needed because it has the positive effect of deterring crime.
DP04_1,3,The death penalty should be maintained because it deters crime.
DP04_1,4,The death penalty is required as it deters crime which is sensible.
DP04_1,5,"The death penalty has the positive effect of deterring crime. Therefore, the death penalty is needed."
DP04_1,6,"Capital punishment benefits society because it may deter violent crime. If the losses society imposes on criminals are less than those the criminals imposed on their innocent victims, society would be favoring criminals, allowing them to get away with bearing fewer costs than their victims had to bear."
DP04_1,7,The death penalty should be instituted to assist in deterring crime.
DP04_1,8,The death penalty is a good thing because it deters crime effectively.
DP04_1,9,Death penalty deters crime.
DP04_1,10,We should use the death penalty because it deters crime.
DP04_1,11,"The death penalty deters crime, making the death penalty necessary."
DP04_1,12,The death penalty produces less crime.
DP04_1,13,"The death penalty is needed, because it deters crimes."
DP04_1,14,"We need the death penalty, because it deters crime."
DP04_1,15,We should keep the death penalty because it deters crime
DP04_1,16,Since the death penalty deters crime the death penalty is a needed part of our society.
DP04_1,17,We need the death penalty because it deters crime.
DP04_2,1,The death penalty is a good thing because it has the positive effect of deterring crime as people fear nothing more than death and nothing will deter a criminal more than the fear of death.
DP04_2,2,The death penalty stops criminals because people are afraid of being put to death.
DP04_2,3,The death penalty is needed because the fear of death deters criminals more effectively than anything else.
DP04_2,4,The death penalty is required as it hinders crime because people fear nothing more than death which is advantageous.
DP04_2,5,The death penalty is useful because the idea of death deters crime seeing as nothing can deter a criminal more than the fear of death
DP04_2,6,"Nothing deters criminals more than the fear of death, because people in general fear nothing more than death. This is why the death penalty has the beneficial effect of deterring crime. Therefore, the death penalty is a must."
DP04_2,7,The death penalty would be a reasonable means to deter crime is in fact people considered the consequences before their actions rather than acted impulsively.
DP04_2,8,The death penalty is a deterrant to crime and so we should continue allowing it.
DP04_2,9,The death penalty is necessary because its use deters crime.
DP04_2,10,"Because people fear nothing more than death, it will deter criminals from committing crime. Therefore, we should support the death penalty."
DP04_2,11,The death penalty should be used to deter a criminal by fear of death.
DP04_2,12,The death penalty is necessary to deter crime using the fear of death as deterrent
DP04_2,13,The death penalty is necessary because it deters crime based on people's fear of death more than anything else.
DP04_2,14,We need the death penalty because it deters crime because people fear nothing more than death and nothing will deter a criminal more than the fear of death
DP04_2,15,"Since people fear nothing more than death, nothing will stop criminals more. Hence, the death penalty is needed."
DP04_2,16,We should accept the death penalty because nothing will deter a criminal more than the fear of death.
DP04_3,1,"People fear the death penalty, so crime is reduced as no one wants to get sentenced to death."
DP04_3,2,The death penalty is needed because it deters crime.
DP04_3,3,The death penalty will make the world a better place by deterring crime.
DP04_3,4,The death penalty is obligatory as mode to deter crime which is advantageous.
DP04_3,5,The death penalty serves as a benefit to society in that it is a means to deter crime. Therefore the death penalty is a valid and needed option.
DP04_3,6,"Some of the most violent criminals can only be deterred from committing crimes by the threat of death, nobody wants violent crime which is why the death penalty is an essential institution."
DP04_3,7,We should continue using the death penalty because it deters crime.
DP04_3,8,We should use the death penalty because it deters crime.
DP04_3,9,We need the death penalty because it is a way to deter crime.
DP04_3,10,We should keep the death penalty because it deters crime.
DP04_3,11,The Death penalty is it effective way of determining crime
DP04_3,12,"We need the death penalty, because it will deter crime."
DP04_3,13,"We should have the death penalty, because it deters crime."
DP04_3,14,We need the death penalty to deter crime
DP04_3,15,Since the death penalty is a way to deter crime the death penalty is a needed resource.
DP04_4,1,The death penalty deters crime because recent credible investigations have found introducing the death penalty correlates with a murder rate.
DP04_4,2,"Recent reliable investigations indicate that the introduction of the death penalty correlates with a murder rate.  Therefore, the death penalty deters crime."
DP04_4,3,The need to introduce the death penalty should correlate with the observed murder rate according to recent well-researched investigations.   The conclusion is that the death penalty deters crime.
DP04_4,4,"The death penalty deters violent crime and makes society safer. Evidence from around the world has shown that the death penalty has no unique deterrent effect on crime.Far from making society safer, the death penalty has been shown to have a brutalizing effect on society."
DP04_4,5,Recent crime rates going down in conjunction with the death penalty as a possible consequence proves the death penalty deters crime.
DP04_4,6,We should use the death penalty because it decreases murders.
DP04_4,7,The death penalty deters crime by correlating with the murder rate.
DP04_4,8,The death penalty correlates with the murder rate so it deters crime.
DP04_4,9,"Recent investigations state that introducing the death penalty correlates with murder rates, this helps deter crime."
DP04_4,10,"The death penalty deters crime, because recent credible investigations claim that the death penalty correlates with murder rate."
DP04_4,11,The death penalty deters crime because it correlates with murder rate
DP04_4,12,"The death penalty isn't always an option when it comes to crime, it is mainly brought into effect when there is a high murder rate which then it shows to lower the murder rate."
DP04_4,13,We should support the death penalty because it deters crime.
DP04_5,1,Although recent studies assert that the death penalty deters crime these studies are not credible because they contain numerous technical and conceptual errors and therefore the death penalty does not deter crime.
DP04_5,2,"The death penalty does not deter crime, and recent studies that indicate otherwise are not reliable because they contain numerous technical and conceptual errors."
DP04_5,3,Recent studies claim that the death penalty deter crime which is implausible  because the studies may contain numerous technical and conceptual errors.
DP04_5,4,There should not be a death penalty becasue there is no credible evidence that it deters crime.
DP04_5,5,"Though recent studies assert that the death penalty deters crime, these studies are rife with technical and conceptual errors. It can therefore be concluded that the death penalty does not deter crime."
DP04_5,6,Without credible sources and studies you're unable to determine statistically if the death penalty reduces crime.
DP04_5,7,The studies about death penalty as a deterrant are flawed and cannot prove the death penalty deters crime.
DP04_5,8,"Studies state that they death penalty deters crime, but they are not credible so it really doesn't deter crime."
DP04_5,9,Recent studies asserting that the death penalty deters crime are not credible.
DP04_5,10,"The death penalty does not deter crime, although many sources state otherwise, these sources are not entirely credible as they are filled with technical and conceptual errors."
DP04_5,11,The data has errors so the death penalty does not deter crime
DP04_5,12,There are too many numerous technical and conceptual errors within recent studies to argue that the death penalty deters crime.
DP04_5,13,"According to some non-credible studies, the death penalty deters crime."
DP04_5,14,"Recent studies wrongly assert that the death penalty deters crime, and they contain numerous technical and conceptual errors."
DP04_5,15,The death penalty does not deter crime because the studies showing that it does contain numerous technical and conceptual errors
DP04_5,16,"Even though there are studies that the death penalty deters crime these studies are not credible since they contain many numerous, technical and conceptual errors, thus the death penalty does not deter crime."
DP04_5,17,We should do away with the penalty because it does not deter crime.
DP04_6,1,"The death penalty does not deter crime because criminologists, who are knowledgeable about the subject, claim that the death penalty does not deter crime."
DP04_6,2,Criminologists do not believe the death penalty deters crime.
DP04_6,3,Criminologists who study the topic agree that the death penalty does not deter crime.
DP04_6,4,The death penalty does not hinder crime as criminologists claim so too.
DP04_6,5,"Crime is beyond man understanding as to why some human go to the extend killing, with regards to this the death penalty does not deter crime committed by this person."
DP04_6,6,"Criminologists as a group are familiar with the topic of crime, and they largely assert that the death penalty does not deter it.  It can be concluded, therefore, that the death penalty does not deter crime."
DP04_6,7,The death penalty should not be adopted because criminologists have shown that it is not effective at deterring crime.
DP04_6,8,"According to criminologists, the death penalty doesn't prevent crime from occurring. Therefore, the death penalty is not necessary to ensure the deterrence of crime."
DP04_6,9,"If even criminologists don't think the death penalty deters crime, it's pretty safe to assume the death penalty is not a crime deterrant."
DP04_6,10,"As asserted by criminologists, the death penalty does not deter crime."
DP04_6,11,"Criminologsts who are familiar with the effects of the death penalty on crime assert that the death penalty does not deter crime.  Therefore we can conclude, based on expert opinion, that the death penalty does not deter crime."
DP04_6,12,Experienced criminologists have shown that death penalty does not deter a crime.
DP04_6,13,The death penalty does not deter crime according to reputable criminologists.
DP04_6,14,Criminologists say that the death penalty does not deter crime so it should not be allowed.
DP04_6,15,Criminologists have not been able to prove that the death penalty deters crime.
DP04_6,16,Criminologists agree that the death penalty does not deter the crime
DP04_6,17,Criminologists agree that the death penalty does not deter crime.
DP04_6,18,The death penalty does not deter crime because criminologists say so
DP04_6,19,We should ban the death penalty because it does not deter crime.
DP05_1,1,A punishment in proportion to a crime is a key property of retributive justice and the death penalty is a punishment in proportion to a serious crime. Therefore the death penalty is retributive justice (not vengeance).
DP05_1,2,The death penalty is a key part of retributive justice because it responds to the severity of the crime.
DP05_1,3,"The death penalty is retributive justice, not vengeance, because it provides a punishment proportional to serious crime."
DP05_1,4,The death penalty is a punishment in proportion to a serious crime which is a key to property of retributive justice.
DP05_1,5,"That a punishment be deemed to be proportionate to the crime committed is a key property of retributive justice, as opposed to vengeful justice. The death penalty can be deemed a proportionate crime in the case of certain highly serious crimes. The death penalty is a sentence that accords with retributive rather than vengeful justice."
DP05_1,6,The death penalty is a proportional punishment and so we can see it as retributive justice.
DP05_1,7,We should use the death penalty because it is a key part of retributive justice.
DP05_1,8,"The death penalty does not appease the victims base desires, nay it is simply equalizing the evil a person has cast into nature."
DP05_1,9,"Because the death penalty is a punishment in proportion to a serious crime, we should consider it retributive justice."
DP05_1,10,The death penalty is retributive justice because it is a punishment in proportion to a serious crime.
DP05_1,11,The death penalty gives equal justice for the crime they have committed.
DP05_1,12,The death penalty is retributive justice because it is punishment for a serious crime.
DP05_1,13,"Since the death penalty is proportional to the crimes committed to get it, it is retributive justice."
DP05_1,14,"The death penalty is retributive justice(not vengeance), because it is a punishment for serious crimes."
DP05_1,15,"The death penalty is not vengeance but retributive justice, because it is a punishment in proportion to a serious crime."
DP05_1,16,The death penalty is retributive justice because the death penalty is a punishment in proportion to a serious crime and a punishment in proportion to a crime is a key property of retributive justice.
DP05_1,17,"As a criminal not only harms people with their crimes but society as whole, retribitutive justice is needed. The death penalty does not fall under this circumstance."
DP05_1,18,The death penalty is retributive justice it is a punishment in proportion to a serious crime.
DP06_1,1,The death penalty is not permissible because the criminal justice system must be fair and the death penalty is racially biased.
DP06_1,2,"Because of the racial bias present in the administration of the death penalty, it should be abolished."
DP06_1,3,The death penalty's racial bias makes it unfair.
DP06_1,4,"As justice must be fair regardless of race, the death penalty is applied unequally, according to racial bias, is therefore unjust."
DP06_1,5,The death penalty is racially biased thus the criminal justice system ought to act in all fairness.
DP06_1,6,I can clearly conclude that the death penalty is not okay because of the percentage  of african americans that are effected by it.
DP06_1,7,"Because the death penalty is racially biased, it does not follow the mandate of the criminal justice system to be fair and impartial.  Therefore the death penalty is not okay."
DP06_1,8,The death penalty is bad because it contains a racially biased component and thus cannot be just or fair.
DP06_1,9,We shouldn't use the death penalty because it is racially biased and therefore is not fair.
DP06_1,10,The racially biased death penalty is not acceptable.
DP06_1,11,The death penalty is racially biased.
DP06_1,12,The death penalty is unacceptable because of the racial bias in the criminal justice system. The death penalty does not follow a fair criminal justice system because of its racial bias.
DP06_1,13,The death penalty does not provide enough margin of error to prevent the death of innocents due to inherent human bias.
DP06_1,14,"There should be no death penalty, because the criminal system is unfair."
DP06_1,15,The death penalty is racially biased and therefore should not be used in the criminal justice system.
DP06_1,16,We shouldn't have the death penalty because it is racially biased and the criminal justice system should be fair.
DP06_1,17,"The death penalty has been shown to be racially baised, in a criminal justice system that must be fair the death penalty does not follow this as racial biases do not allow for a fair system."
DP06_1,18,We should not accept the death penalty because the criminal justice system is racially biased.
DP06_2,1,The death penalty is racially biased as a greater number of one race is executed far more frequently than the average population demographic.
DP06_2,2,The death penalty is racially biased because it is disproportionately applied to certain racial groups.
DP06_2,3,The death penalty is racially biased which induces the death sentence of a particular race becoming higher as compared to the population.
DP06_2,4,The death penalty is racially biased because the death sentence rate of a particular race is high compared to the general population.
DP06_2,5,"Currently, the death sentence rate of a particular race is high as compared to the overall imprisoned population. This bears out the assumption that if the death penalty is racially biased then the death sentence rate of a particular race will be seen as high compared to the overall imprisoned population. Based on current statistics, the death penalty is indeed racially biased."
DP06_2,6,The death penalty has a racially biased component we can identify through which race is disproportionately sentenced to the death penalty.
DP06_2,7,The death penalty is racially biased because the death sentence of a particular race is high compared to the population.
DP06_2,8,The death penalty is higher among a particular race.
DP06_2,9,"The death penalty is racially biased, because the death sentence of a particular race is high compared to the population."
DP06_2,10,"The death penalty is racially biased, because the death sentence rate of a particular race is high compared to the population."
DP06_2,11,The death penalty is racially biased because the death sentence rate of a particular race is high compared to the population as a whole.
DP06_2,12,The death penalty is racially biased because the death sentence rate of a particular race is high compared to the population
DP06_2,13,The death penelty has been shown to have an increased rate of occurance among people of a certain race.
DP06_2,14,The death penalty is racially biased because it kills more minoirites than others
DP06_2,15,The death penalty  is racially biased compared to the population.
DP06_2,16,The death penalty is racially biased because the death sentence rate of a particular race will become high compared to the population.
DP06_3,1,The death penalty is not racially biased because it is based on poverty and crime rates.
DP06_3,2,"Though death sentences are disproportionately applied to some racial groups, this does not indicate racial bias because the high poverty and crime rates of particular races are also contributing factors."
DP06_3,3,Poverty is to blame for the high death sentence rate of a particular race compared to the population.
DP06_3,4,Some may claim that the high death sentence rate of a particular race compared to the population is caused by the racially biased death penalty which is not true as the high poverty rate leads to the high crime rate hence the death sentence of the race.
DP06_3,5,"While theorists propose that the high death sentence rate of a particular race compared to the overall population is caused by the racially biased death penalty, there are other factors that  affect the high death rate of the disadvantaged group. For example, the high poverty rate of the race in question leads to a higher crime rate among the disadvantaged group, which in turn leads to a higher death sentence rate than that of the overall population. It can therefore be concluded that the death penalty is not racially biased."
DP06_3,6,"The Death Penalty Information Center has released a major new report on race and the U.S. death penalty, providing an in-depth look at the historical role race has played in the death penalty and detailing the pervasive impact racial discrimination continues to have throughout every stage of a death penalty case today"
DP06_3,7,"The death penalty is not necessarily racially biased. It is just such that higher poverty and higher crime rates typically go hand in hand, and poverty rates are higher in minority communities."
DP06_3,8,There is no racial bias in the death penalty because the death penalty is much more closely linked to poverty than to race itself.
DP06_3,9,High poverty rate leads to high crime rate which can be more frequent in a certain race but does not mean the death penalty is racially biased.
DP06_3,10,High poverty rates relate to crime so the death penalty is not racially biased
DP06_3,11,The death penalty rate is in more accordance to the high poverty rate of particular races than any notable racial bias.
DP06_3,12,"The death penalty isn't racially biased,, because the poverty rate increases high rate of crime and death sentences."
