fragment_id,response_no,response
DP06_3,13,"The death penalty is not racially biased. Although there is a high death sentence rate of a particular race compared to the population, this is not because of the death penalty but rather the high poverty rate of that particular race."
DP06_3,14,The death penalty is not racially biased because race is correlated with higher poverty and higher poverty is correlated with a higher death sentence rate.
DP07_1,1,The death penalty should be avoided because it leads to the killing of innocent people due to mistakes made by the criminal justice system.
DP07_1,2,"The criminal justice system, rather than the death penalty, should be blamed for innocent people being killed."
DP07_1,3,The death penalty is intolerable as it fuels killing innocent people which is inappropriate as the criminal justice may make a mistake.
DP07_1,4,"Since the criminal justice system is not infallible and may sanction the killing of innocent people, it is important to abolish the death penalty"
DP07_1,5,"Although killing innocent people is never the goal of the death penalty it can lead to such a case, because the criminal justice system can make a mistake. Therefore, the death penalty should not be the standard."
DP07_1,6,"The criminal justice system may make a mistake, leading to the death of an innocent person. Therefore, the death penalty should not be adopted."
DP07_1,7,The death penalty is a bad thing because it may lead to the deaths of innocent people.
DP07_1,8,the death penalty should not be an option due to the chance of killing innocent people with any mistake performed by the criminal justice system
DP07_1,9,"The death penalty is not okay, because the criminal justice system may make a mistake and kill innocent people."
DP07_1,10,We don't need the death penalty because it can kill innocent people because the criminal justice system may make a mistake
DP07_1,11,Since the criminal justice system can make a mistake and killing innocent people is a bad thing the death penalty is not needed.
DP07_2,1,The death penalty has the undesirable effect of leading to killing innocent people due to prosecutorial misconduct and is therefore not acceptable.
DP07_2,2,The death penalty should be abolished because it leads to the killing of innocent people due to prosecutorial misconduct.
DP07_2,3,The death penalty is intolerable as it induces killing of innocent people due to prosecutorial misconduct which is dispensable.
DP07_2,4,"Prosecutorial misconduct can lead to a death penalty verdict and the unwanted killing of an innocent person. For this reason, the death penalty is not okay."
DP07_2,5,Doesn't the death penalty prevent crime? Not according to the research. There is no credible evidence that the death penalty deters crime more effectively than a prison term.
DP07_2,6,"There is no 100% definite way to prove the case that someone desreves to die. The rish of killing someone innocent is too great and has happened before. Even if someone did something that is bad enough to deserve it, more thank likely death is too easy. They should live life in prision living with what they did."
DP07_2,7,The death penalty is a bad idea because prosecutorial misconduct can lead to the conviction and killing of innocent people.
DP07_2,8,"We shouldn't have the death penalty because it leads to killing innocent people, which  we shouldn't do."
DP07_2,9,The death penalty shouldn't exist because it leads to the killing of innocent people.
DP07_2,10,We should not have the death penalty because innocent people may be killed because of prosecutorial misconduct.
DP07_2,11,"Innocent people have been killed by the death penalty due to prosecutorial misconduct, as such the death penalty is a bad idea."
DP07_3,1,The death penalty should be abolished because it results in the irreversible and irreparable killing of innocent people.
DP07_3,2,Ending the death penalty would save innocent people.
DP07_3,3,The death penalty is intolerable because it induces killing of innocent people which is an act that cannot be undone.
DP07_3,4,"Use of the death penalty may lead to the irreversible and irreparable consequence of killing innocent people.  therefore, the choice of using the death penalty is not a tolerable one."
DP07_3,5,The death penalty should be done away with because it might lead to the deaths of innocent people.
DP07_3,6,Innocent people have been executed for crimes they did not commit.
DP07_3,7,Innocent people could be killed by death penalty and should be eliminated from the system.
DP07_3,8,The death penalty might kill innocent people so it is not acceptable.
DP07_3,9,"We should not have the death penalty, because it may end up killing innocent people, which is irreversible and irreparable."
DP07_3,10,"The death penalty should be abolished because it may lead to killing innocent people, an irreversible and irreparable action."
DP07_3,11,"We should not allow the death penalty because it may end up killing innocent people, which is irreversible and irreparable."
DP07_3,12,"The death penalty has in the past killed innocent people, the loss of innocent life is irriplaceable as such the death penalty is not allowable because it could take innocent lives."
DP07_4,1,People on death row have been found innocent in the past thanks to DNA testing. The criminal justice system is making a mistake by keeping the death penalty around.
DP07_4,2,"The death penalty causes the death of innocent people, as is seen by the exonerations of innocent people due to DNA testing."
DP07_4,3,DNA testing can be used to show when the criminal justice system makes a mistakes and can prevent innocent people from being killed.
DP07_4,4,The death penalty induces killing innocent people as the criminal justice system makes a mistake as some on death row were found to be innocent due to DNA testing.
DP07_4,5,"Since some death row prisoners were shown by DNA testing to be innocent of their presumed crimes, it means that the criminal justice system is able to make a mistake. We can only conclude that the death penalty leads to killing innocent people."
DP07_4,6,"Some people on death row were wrongfully convicted because of new evidence in light of DNA testing. Thus, if the criminal justice system can mistakenly place an innocent person on death row."
DP07_4,7,Mistakes in DNA testing suggest that there may be innocent people being killed on Death Row
DP07_4,8,The death penalty should be overturned so that no more wrongfully convicted people are executed.
DP07_4,9,The Justice system is not an infallible entity and because of DNA testing it seems that it has been sending people to death row who are innocent.
DP07_4,10,The death penalty could accidentally cause killing of innocent people because some on death row were found to be innocent due to DNA testing.
DP07_4,11,"Unfortunately, some on death row were found to be innocent due to DNA testing, this proves that the criminal justice system can make mistakes and such the death penalty leads to the deaths of innocent people."
DP07_5,1,"Death row has individuals who are proven innocent thanks to DNA testing, so there should be many checks to make sure the person is truly guilty."
DP07_5,2,"Although some death row inmates were found innocent due to DNA testing, multiple assurances are applied before death sentences are carried out.  This does not represent a failure of the system, and the death penalty does not lead to the deaths of innocents."
DP07_5,3,DNA testing could prevent innocent from being killed.
DP07_5,4,"While some prisoners on death row were found to be innocent due to DNA testing, this merely means that multiple assurances are applied before a death sentence is carried out.  Such does not constitute a failure of the system.  Therefore, it can not be concluded that the death penalty leads to killing innocent people."
DP07_5,5,"Despite the occasional failure of DNA evidence, so many assurances are applied before a death row sentencing that it is unlikely the death penalty leads to the killing of innocent people"
DP07_5,6,We should use the death penalty because safety measures prevent innocent people from being killed.
DP07_5,7,The death penalty does not kill innocent people because there are ways to check to make sure the person is innocent.
DP07_5,8,"Multiple assurances are applied before a death sentence, such as DNA testing. Therefore, the death penalty does not lead to killing innocent people."
DP07_5,9,"The death penalty doesn't kill innocent people, multiple assurances are taken."
DP07_5,10,Innocent people are not killed by death penalty because of the extensive DNA testing performed before the sentencing is completed.
DP07_5,11,There are assurances via DNA so the death penalty does not kill innocent people.
DP07_5,12,multiple assurances are applied before a death sentence to avoid the killing of innocent people
DP07_5,13,The  death penalty doesn't cause innocent people to be killed; it just means there should be multiple assurances.
DP07_5,14,"Innocent people are not killed by the death penalty because some on death row were found to be innocent due to DNA testing, meaning that multiple assurances are applied before a death sentence"
DP07_5,15,"Since some on death row have been found to be innocent due to DNA testing this means that multiple assurances are used before the death sentence is carried out, as such the death penalty does not kill innocent people."
DP07_5,16,We should accept the death penalty because multiple assurances are applied before a death sentence.
DP07_6,1,The death penalty is reasonable because the higher standard in death penalty cases makes it unlikely that innocent people will die.
DP07_6,2,The death penalty is acceptable because the chance of killing innocent people is low since the justice system has a high standard for death penalty cases.
DP07_6,3,"Some claim the death penalty induces killing innocent, although the possibility is very low as the criminal justice system rightfully demands a higher standard for the death penalty cases thus death penalty is inevitable."
DP07_6,4,"The criminal justice system rightfully demands a higher standard for death penalty cases. So, while theorists argue that the death penalty leads to killing innocent people, the possibility is actually very low. Therefore, the death penalty is okay."
DP07_6,5,"Although some will argue that innocent people may be killed when the death penalty is enforced, the possibility of this happening is low, because of the criminal justice system's high standards for these cases."
DP07_6,6,"While some say the death penalty leads to the killing of innocent people, in fact the burden of proof is so high in death penalty cases that the wrong person is rarely convicted."
DP07_6,7,Soicietal rebukes that innoncent lives are slain via the death penatly are unfounded on the strict judical system with it's checks and balances.
DP07_6,8,"The criminal justice system demands a high standard for death penalty cases, so few innocent people are killed. Therefore, the death penalty should be legal."
DP07_6,9,The death penalty is acceptable and safe from executing innocent people by the fact those convicted have numerous appeals that take years. So much so that most sentences are not carried out until decades after the original crime was committed.
DP07_6,10,The very low possibility of innocent people getting killed makes the death penalty acceptable.
DP07_6,11,The criminal justice system demands a higher standard for death penalty cases to avoid the killing of innocent people.
DP07_6,12,"The death penalty is needed, because the criminal justice system demands a higher standard for the death penalty cases."
DP07_6,13,"The death penalty is okay, because the possibility of killing innocent people is very low since the criminal justice system rightfully demands a higher standard for the death penalty cases."
DP07_6,14,The death penalty should be kept because there is a lower risk of killing innocent people because of the higher standard for death penalty cases.
DP07_6,15,While some may argue the death penalty kills the innocent this is a very low possibility as the criminal justice system rightfully demands a higher standard of quality for the death penalty cases.
DP07_6,16,We should accept the death penalty because the criminal justice system rightfully demands a higher standard for the death penalty cases.
DP07_6,17,"Despite what many believe, the death penalty is less likely to lead to killing innocent people because the criminal justice system demands a higher standard for death penalty cases."
DP08_1,1,We should introduce life in prison without parole because the death penalty is too cruel and we need one or the other.
DP08_1,2,Life in prison without parole is an equal punishment to death and therefore should be promoted in place of the death penalty.
DP08_1,3,Introduction of life in prison without parole is required as it is better than the death penalty as it as severe as death penalty.
DP08_1,4,We should introduce life in prison without parole because it is the most severe of the two warranted punishments (life without parole or the death penalty) for certain crimes.
DP08_1,5,"For some crimes. the death penalty or life in prison without parole is necessary. Yet, life in prison without parole is as severe as the death penalty, therefore preferable. We should therefore introduce a sentence of life in prison without parole."
DP08_1,6,Life in prison without parole should be seen as a viable alternative to the death penalty because the punishment is just as severe.
DP08_1,7,Life in prison without parole is okay because it's just as bad as the death penalty.
DP08_1,8,We should introduce life in prison without parole because it is as severe as the death penalty.
DP08_1,9,We should introduce life in prison without parole because it is better than the death penalty.
DP08_1,10,Life in prison is the same as the death penalty so it should be introduced
DP08_1,11,"Life in prison should be considered an alternative to the death penalty, being equally severe."
DP08_1,12,"We should introduce life in prison without parole, because life in prison without parole is better than the death penalty."
DP08_1,13,"We should introduce like in prison without parole because it is less severe, and therefore better, than the death penalty."
DP08_1,14,We should introduce life in prison without parole because it is better than the death penalty
DP08_1,15,A response to crime is needed either the death penalty or life in prison. Life in prison without parole is as just severe as the death penalty henceforth life in prison without parole should be introduced.
DP08_1,16,Life in prison without parole should be introduced because it is just as severe as the death penalty.
DP08_2,1,"The death penalty is an extremely expensive procedure to follow, almost 3 times more expensive than life without parole. Life without parole should be the maximum punishment as it saves money and keeps things more moral."
DP08_2,2,Life in prison without parole is preferable to the death penalty because it saves taxpayers times as much money.
DP08_2,3,Life in prison without parole costs less than the death penalty.
DP08_2,4,Introduction of life in prison without parole is mandatory as it better than the death penalty as each death penalty trial costs a country three times more than a trial seeking death in prison.
DP08_2,5,"It is extraneous to have both the death penalty and life in prison without parole options. As it is necessary to have one of these choices, it's best to opt for life in prison without parole, as each death penalty trial costs a country three times more than a trial seeking death in prison.  We should therefore introduce life in prison without the possibility of parole as the single option."
DP08_2,6,Life in prison as opposed to the death penalty is a lot cheaper and we should encourage it more.
DP08_2,7,Life in prison without parole should be introduced instead of using the death penalty because it does not cost a country as much money.
DP08_2,8,Life in prison without parole should be considered instead of the death penalty because it costs less than a death penalty trial.
DP08_2,9,"We should introduce life in prison without parole because it is better than the death penalty, and one is necessary."
DP08_2,10,People should be able to spend life in prison withouth parole because it is better than the death penalty.
DP08_2,11,"With our current judicial system, the death penalty is no longer a practical option for serious crimes due to institutional and procedural time and expense, and life in prison without parole is a cost-effective alternative solution."
DP08_2,12,We should introduce life in prison without parole because death penalty trials cost three times more.
DP08_2,13,Life in prison should be used as opposed to death penalty because the cost is much cheaper to the country.
DP08_2,14,Since the death penalty costs the country more there should be instead life without parole.
DP08_2,15,Life in prison without parole costs three times less than the death penalty and should be introduced as an option.
DP08_2,16,"We should introduce life in prison without parole, because each death penalty costs a country three times more than a trial seeking death in prison."
DP08_2,17,"We should introduce life in prison without parole rather than the death penalty, because each death penalty costs a country three times more than a trial seeking death in prison."
DP08_2,18,We should introduce life in prison without parole because death penalty trial costs a country three times more than a trial seeking death in prison.
DP08_2,19,We need life in prison without parole because it is better than the death penalty in tha tit costs less.
DP08_3,1,Life in prison without parole should not be allowed because it denies the possibility of redemption.
DP08_3,2,Life in prison is below bar as it denies the possibility of redemption which is inappropriate.
DP08_3,3,Life in prison without parole is not fair as it denies the possibility of redemption
DP08_3,4,To sentence a prisoner to a life in prison without the possibility of parole assures the detrimental effect that said prisoner is denied the possibility of redemption.  One must conclude that a sentence of life in prison without parole is not a tolerable choice.
DP08_3,5,We should never sentence someone to life in prison without parole because doing so denies them the possibility of redemption.
DP08_3,6,It is wrong to sentence criminals to life in prison without parole. Doing so denies them the possibility of redemption.
DP08_3,7,We shouldn't sentence people to life without parole because we can't expect people to want to change when there is no possibility of redemption.
DP08_3,8,"Life in prison without parole is not a good thing, it denies the possibility of redemption."
DP08_3,9,Life in prison without the chance of parole disallows the possibility of redemption.
DP08_3,10,Since there is no redemption with a life in prison is not optimal
DP08_3,11,"Life in prison without parole is unethical, because it eliminates the possibility of redemption."
DP08_3,12,We should not have life in prison without parole since it denies the possibility of redemption.
DP08_3,13,Life in prison without parole is bad because it denies the possibility of redemption
DP08_3,14,"Life in prison denies the prisoner a possibility of redemption and as that is not a good thing, life in prison without a parole is not a good thing."
DP08_3,15,Life in prison withoutparaole is not necessary because it denies redemption
DP08_3,16,We should not accept life in prison without parole because it denies the possibility of redemption.
DP08_4,1,Life in prison without parole is not permissible as it is just as cruel as the death penalty because life in prison prisoners are treated as dead men.
DP08_4,2,Life in prison without parole should not be an option because life in prison prisoners are treated as dead men.
DP08_4,3,Life in prison without parole is intolerable as it equal to death penalty because prisoners under life in prison are treated as dead men.
DP08_4,4,"Prisoners granted a life without the possibility of parole are treated as dead men while yet imprisoned, which makes their life in prison as cruel as a life under a death penalty sentence would be.  The inevitable conclusion is that a life in prison without parole is not a tolerable choice."
DP08_4,5,"Life in prison is not acceptable because prisoners are treated like dead men, which is as cruel as the death penalty."
DP08_4,6,Life in peison without payrole as cruel as death penalty and the prisoners are treated as dead men.
DP08_4,7,Life in prison without parole should not be allowed because it's just as bad as the death penalty.
DP08_4,8,We should not have life in prison without parole as it is as bad as the death penalty.
DP08_4,9,We should not allow life in prison without parole because it is as cruel as the death penalty.
DP08_4,10,People should not get life in prison without parole because it is cruel.
DP08_4,11,"We should not allow life in prison without parole, because otherwise it would be as cruel as the death pentalty."
DP08_4,12,Life in prison without parole should not be use because the prisoners are treated as dead men.
DP08_4,13,"Life in prison isn't acceptable, because it treats prisoners as dead men; that is as cruel as the death penalty."
DP08_4,14,"We should not have life in prison without parole, because it is as cruel as the death penalty since life in prison prisoners are treated as dead men."
DP08_4,15,We should not have life in prison without parole because it is as cruel as the death penalty because life in prison prisoners are treated as dead men
DP08_4,16,Life in prison is the same as the death penalty because the prisoners are treated as if they're dead already.
DP08_4,17,We should not accept life in prison without parole because it is as cruel as the death penalty.
DP08_5,1,Prisoners should not be sentenced to life without parole because such sentences create psychiatric symptoms.
DP08_5,2,Psychiatric symptoms to prisoners are reason to end life in prison without parole.
DP08_5,3,Life in prison without parole is intolerable as it causes psychiatric symptoms to prisoners which is dispensable.
DP08_5,4,It's been shown that life in prison without parole causes psychiatric symptoms in prisoners that are incompatible to their rehabilitation and future life potential.  Therefore life in prison without parole is not acceptable.
DP08_5,5,Sentencing a criminal to life in prison without the possibility of parole is not acceptable because it causes psychiatric symptoms in prisoners.
DP08_5,6,"A prison sentence should not include life without the possibility of parole, because it leads to prisoners developing psychiatric symptoms."
DP08_5,7,"Because of the psychiatric symptoms involved with being incarcerated for life in prison without parole, life imprisonment without parole is an intolerable concept."
DP08_5,8,Life in prison should be prohibited as a sentence because it causes psychiatric harm to prisoners.
DP08_5,9,Life in prison without parole can cause psychiatric symptoms to prisoners and that is unaccpetable.
DP08_5,10,Life in prison without parole should not be used because it causes psychiatric symptoms in prisoners.
DP08_5,11,Life in prison without parole is unacceptable because it causes psychiatric symptoms in prisoners.
DP08_5,12,Life in prison can cause psychiatric symptoms
DP08_5,13,"We don't need life in prison without parole, because it causes psychiatric symptoms to prisoners."
DP08_5,14,Life in prison without parole causes psychiatric symptoms to prisoners and should not be done.
DP08_5,15,We should not have life in prison without parole because it causes psychiatric symptoms to prisoners.
DP08_5,16,Life in prison has been showed to have numerous adverse affects on the human psyche which should be avoided.
DP08_5,17,Life without parole is not necessary because it causes mental health issues
DP08_5,18,We should not accept life in prison without parole because it causes psychiatric symptoms to prisoners.
